TITLE,LIKES,SHARES
Prime Minister Hun Sen presided over the groundbreaking ceremony of the Choeung Ek Wastewater Treatment Facility – to be built using more than $20 million in aid from Japan – in Chak Angre Leu commune’s Prek Ta Kong I village of Phnom Penh’s Meanchey district.,18,0
"On February 21 and 22, authorities from the municipal administration and medical staff dispersed the former staff as they began to congregate near their former workplace. Some were placed in the Phnom Penh Quarantine Centre.",34,0
"Farming in South Korea evolves with the assistance of IT, AI",6,0
Why crypto creators desire to remain out of the spotlight,8,0
"In Opinion:
On February 21, 1972, Richard Nixon became the first US president to visit the People’s Republic of China, setting in motion a process that would end China’s decades-long isolation and kick-start the emergence of a modern, dynamic economy.",20,0
A senior Ministry of Environment official said pangolins were the most traded species of mammal in the world due to their use in traditional Chinese medicine while in Cambodia the species is widely threatened by illegal hunting and trapping carried out to supply that industry.,8,1
"In January, 6,891 Cambodian migrant workers returned from Thailand, 54 of them were diagnosed with Covid-19 and 595 were placed in quarantine, according to a report from the International Organisation for Migration (IOM) in Cambodia.",9,0
Food and culture have always been intimately connected and the rich flavours of Cambodian food are accompanied by a fascinating array of stories and traditions that go back centuries.,29,3
"The bank held more than $8 billion in accounts of criminals, dictators and human rights abusers, among others, according to the investigation by a group comprising dozens of media organisations.",11,0
"Ukraine and Russia called for intensified diplomatic efforts on February 20 to avert all-out war, each blaming the other for a sharp escalation in shelling on the front line separating Kyiv’s forces from Moscow-backed separatists.",4,1
"Vietnam Engine and Agricultural Machinery Corp (VEA) ended 2021 with revenue of 4.02 trillion dong ($176.4 million), an increase of 9.6 per cent compared to 2020.",6,0
"Cambodia booked just $184 million in international tourism revenue last year, marking an 82 per cent nosedive from $1.023 billion in 2020, as the Covid-19 pandemic curtailed travel throughout the world.",10,0
"The Pursat Provincial Administration is reviewing a decision made by the provincial land management committee, following a request from 20 families. The decision concerns 37.5ha of land in O’Som commune’s Chhay Lok village of Veal Veng district.",4,0
Preah Sihanouk provincial police have been deploying officers to search vehicles for weapons and spot drivers who are under the influence of drugs or alcohol in order to strengthen public safety and maintain order in certain parts of Sihanoukville.,25,1
The Kingdom’s 219 “blue helmets” on February 20 departed for a humanitarian mission in the Central African Republic (CAR).,9,0
Police in Battambang province’s Banan district and forensic specialists on February 20 inspected a human skeleton in Chhoung Svay Cave in Ta Kriem commune’s Ta Ngen village after villagers had found the remains and reported the discovery the day prior.,9,1
"More than 60,000ha of flooded forest land in Zone 3 in the six provinces around the Tonle Sap Lake has been reclaimed from nearly 15,000 families and returned to the state.",14,0
Police forces set to stagger shifts for social distancing,7,0
"Canada's Mercan Group has entered into a partnership agreement with four local real estate and financial companies to attract more players into the Cambodian real estate market, and create new investment opportunities abroad for local investors.",12,0
"The Prek Toal Ramsar-site of the Tonle Sap Lake Biosphere Reserve – in Ek Phnom district’s Koh Chivaing commune of Battambang province – is full of flooded forest, which is not only a spawning ground for fish but also a breeding ground for many species of birds.",31,2
"More than 1,000 families have drawn lots for land plots at Boeung 75 in Tuol Pongro commune’s O’Ampil village of Banteay Meanchey province’s Malai district after a long-running dispute was resolved.",19,1
"A development strategy designed to transform the Cambodian garment trade into a dynamic, diversified, high-value and competitive sector – with a focus on the upskilling of factory workers – will be launched soon",4,0
"Investments by Japanese enterprises in non-textile areas of manufacturing have played an important role in diversifying the Kingdom’s economy, according to the head of the Council for the Development of Cambodia (CDC).",17,1
Many rare species of wild animals such as clouded leopards and bears continue to be found in the Cardamom Mountain range.,26,3
"Cambodia records two new Covid deaths, 572 Omicron community cases",21,1
The National Election Committee (NEC) has called on all municipal and provincial electoral commissions to ensure the smooth operation of the upcoming commune council elections.,7,0
"Women form an incalculable part of Cambodia’s economy, Prime Minister Hun Sen has declared, as he praised efforts of the Cambodian National Council for Women’s (CNCW) in contributing to the Kingdom’s development over the years.",11,0
"The Ministry of Health and Covid-19 commissions across the country have urged the public to increase vigilance amid a surge in Omicron cases, as some in the capital began stocking up on antiviral medication to prepare for the possibility of catching the virus.",33,0
"In Opinion:
Multilateralism key to a prosperous East Asia",8,0
"The sudden death of a young employee at a Chinese internet giant has reignited a debate about the gruelling culture of overtime work in China’s tech industry, with the firm describing his passing as a “wake-up call”.",3,0
"Touted as the next big thing, the metaverse has been undeniably the talk of the global town since last year. The metaverse frenzy accelerated further when Facebook changed its name to Meta in October.",9,0
The designs and collections of the students at MaPa Fashion Design Academy were recently featured in a runway show with 66 models of varying nationalities as part of the students’ graduation projects and to promote the school.,15,0
"Vietnam's Ministry of Culture, Sports, and Tourism has released guidelines to implement the second phase of the pilot Covid-19 vaccine passport programme to welcome international tourists.",13,1
"Pay Solutions will seek approval from the Bank of Thailand (BOT) to become the first online payment service provider in the country that legally uses a cryptocurrency to pay for goods and services, its CEO said.",14,1
"The footwear industry has been growing rapidly in the last few years, employing more than 130,000 workers and attracting a lot of new investment in 2021. Cambodian Footwear Association president Ly Khun Thai sits down with The Post’s May Kunmakara to discuss the industry and how the prolonged spread of Covid-19 might affect the industry.",2,0
"Recent research on how long Covid-19 virus can survive on plastic and skin shows that Omicron is significantly more stable than previous variants, said a Thai infectious disease expert on February 19.",10,1
"Britain's 95-year-old Queen Elizabeth II tested positive for Covid-19 on February 20 but her symptoms are ""mild"" and she intends to continue with light duties at her Windsor Castle residence, aides said.",35,1
Singapore-invested 100sq km agriculture hub launched in northern Kampong Speu,86,33
"The Kep Provincial Administration announced that all business owners and service providers related to media, printing and electronics must fill out application forms and pay fees for renewing advertising permits for 2022 before April 29.",14,0
The National Election Committee (NEC) announced the relaxation of rules in order to allow political parties it has formally recognised to register their candidates and agents by proxy.,12,0
"The Ministry of Post and Telecommunications’ decision to suspend the licence of prominent internet service provider (ISP) Opennet will not affect the plans and services for existing customers, according to ministry secretary of state So Visothy.",4,0
Pursat provincial governor Cheav Tay on February 18 instructed the One Window Service Unit to review billboards across the province. Any which are damaged should be replaced by their owners by March 1.,9,0
"Cambodia-Malaysia trade volume surpassed $500 million in 2021, rising by 13.14 per cent over a year earlier, according to the Ministry of Commerce.",2,3
The government is on track to spend more than $2.127 billion or about three-fifths of Cambodia’s state savings of $3.5 billion over the 2020-2022 period to manage the impact of the Covid-19 crisis on key sectors,13,2
"Khim Finan, the governor of Banteay Srei district in Siem Reap province, said he would welcome the opening of an investigation into his conduct, after a businesswoman sued him for “inciting and invading private property, and non-compliance with a court decision”.",27,2
An activist monk from the Sorng Rukhavoan Forest Community called on authorities to search for poachers who trapped and killed a banteng in Oddar Meanchey province’s Anlong Veng district on February 18.,19,1
"Cambodia logs three new Covid deaths, 473 Omicron community cases",27,2
Sar Kheng tells officials to solve encroachment in Battambang province area,14,0
"Ministry of Health spokeswoman Or Vandine has warned that the daily number of Covid-19 cases could soon be in the thousands, should prevention measures not be strictly enforced in the face of rising community transmission of the highly infectious Omicron variant.",37,5
Two new Covid deaths as daily Omicron community cases in Cambodia jump to over 700,52,4
"A temporary ferry service between Koh Pich Island and Koh Norea across Bassac River in the capital will be available daily from February 21, from 6am to 7pm.",35,4
Minister of Environment Say Sam Al on February 18 called on the younger generation to learn how to capitalise on technological innovations and key developments for their personal gain and in the interests of the Kingdom.,7,1
"Everything Will be OK, Cambodian Rithy Panh’s exploration of a dystopian future where animals have enslaved humans and taken over the world, won a Silver Bear for artistic contribution.",15,1
[Post Focus] Seara Cambodia’s innovative solutions strengthening Kingdom’s fitness scene,15,1
"Schools and other educational institutions can shut down for at least a week if any student or teacher is found to have contracted the novel coronavirus, Minister of Education, Youth and Sport said in an instruction on February 18 as new daily confirmed Covid-19 cases remain on an upward trajectory.",10,0
South Korean chipmaker SK hynix on February 16 introduced a next-generation memory chip that processes data 16 times faster and consumes 80 per cent less electricity.,10,0
"Capital’s artists celebrate new IKIGAI centre’s fresh facilities, forward focus",33,2
"Vietnam is likely to be a key beneficiary of the Regional Economic Comprehensive Partnership (RCEP) regarding tariff reductions and foreign direct investment, Singapore's leading consumer bank DBS said in a recent report.",12,0
PM sends condolence letter to wife of late Cambodia-based Japanese philanthropist,11,0
"Another 19 former staff of NagaWorld integrated resort, who have been protesting after being laid off due to Covid-19, have tested positive for the novel coronavirus.",10,0
"An APSARA National Authority (ANA) team is preparing a new visiting circuit at Neak Pean, or “entwined Nagas”, a small Buddhist temple on an artificial island in the middle of the North Baray (Jayatataka) reservoir on the northern boundary of Siem Reap town, in Angkor Archaeological Park.",24,1
"The Kingdom has asked for Singapore’s continue support in training the Royal Cambodian Army, and the city-state said it was ready to send trainers or accept troops for a course.",13,0
"ANA, Toyota, US’ Joby mull business tie-up for flying car venture",8,0
ASPIRE uplifts rural farming communities: agriculture minister,5,0
Daily Omicron community cases in Cambodia top 500,30,1
"The volume of imports and exports handled at the Sihanoukville Special Economic Zone (SSEZ) notched up more than $217 million in the first month of 2022, marking a 45.64 per cent rise year-on-year, according to a statement released by the operator.",13,2
"Cambodia will see a marked uptrend in international tourists from mid-2022 as more travel packages are developed and marketed, according to the Ministry of Tourism.",71,9
Singapore intends to invest in cold storage in Cambodia as the agricultural sector faces a dire need to safely and adequately store quality products to boost exports.,17,1
[Advertorial] Metfone marks 13 years in Cambodia with mission to create ‘A Connected Digital Society’ in the Kingdom,5,0
"The Wildlife Conservation Society Cambodia Programme (WCS) has said it safely released 35 Cantor's giant softshell turtle hatchlings into the wild along the Mekong River on February 17, in Kratie province’s northernmost district of Sambor.",11,0
"The number of prenatal and postpartum follow-up visits across the country has seen a significant drop during the Covid-19 era, despite government efforts to tackle social protection challenges and help the most vulnerable during the pandemic, according to Cambodian Red Cross (CRC) president Bun Rany.",4,0
The value of bilateral trade between Cambodia and Laos jumped from $10-20 million previously to more than $100 million in 2020.,9,1
The national Covid-19 vaccination committee has announced that medically eligible children aged 3-4 can receive a primary two-dose coronavirus vaccine series starting on February 23 – exclusively with the inactivated virus jabs developed by Chinese firms Sinovac and Sinopharm.,5,2
"Cambodia and Hungary have convened their first formal business talks to further boost economic and trade partnerships, as trade between the two countries reached just over $5 million last year.",4,2
The Pailin Provincial Department of Water Resources and Meteorology has laid out four strategic plans to build reservoirs and irrigation systems to supply the agricultural sector. This sector is a priority of the province as more than 70 per cent of the population are farmers.,9,0
The “Community Solution for Plastic-Free Coastlines” programme was rolled out in Preah Sihanouk province on February 17 to tackle the growing issue of plastic pollution in Cambodia’s coastal areas.,16,0
"Minister of Health Mam Bun Heng told heads of the primary Covid-19 management committees in the capital and the provinces to raise awareness of the standard operating procedure (SOP) and other instructions for the treatment, care and management of Covid-19 at home, and remind residents to adhere to them.",19,1
"Phnom Penh, along with Kandal and Kep provinces, will no longer be first-priority areas for continued operations to clear anti-personnel mines.",12,0
"Stick to ‘Living with Covid’, PM says as Omicron rages",24,1
"Real estate developer Kim Heang recently made remarks on social media regarding matters related to Cambodia’s national cultural heritage that stirred up controversy and drew denunciations from a number of leading figures in government, academia and even his own associates in the business community.",59,9
"Tuberculosis (TB) remains a concern in Cambodia despite a steady decline in mortality and infection rates – with many cases remaining undiagnosed and causing active community transmission, according to a senior official at the US Agency for International Development (USAID) Cambodia.",10,1
The Ministry of Justice and its Thai counterpart have held talks on ASEAN cooperation in the fields of criminal justice and the fight against transnational crime.,2,0
"The government is reviewing the draft National Intellectual Property Policy in a bid to make the legal instrument more comprehensive and in-depth, and create a more developed and sustainable intellectual property (IP) landscape.",6,0
"With cases of the Omicron coronavirus variant on the rise in Cambodia, especially in Phnom Penh, the head of government and the Ministry of Health have urged caution and reminded people to practise preventive measures – particularly in markets.",26,2
The Telecommunication Regulator of Cambodia (TRC) has blocked 14 internet domains which ran illegal gambling websites in Cambodia and one which offered fake visa applications for Pakistan.,9,0
Another 388 Omicron community cases in Cambodia,30,0
Sokhonn will open embassy in Turkey,12,1
"Cambodia and Singapore reiterated their commitment to deepening long-term relations between the two countries, while also agreeing to urge the Myanmar military to fully and expeditiously implement the ASEAN five-point consensus (5PC).",13,0
"Children aged 3 to under 5 will be offered Covid-19 vaccinations, Prime Minister Hun Sen has announced.",15,3
"Minister of Foreign Affairs and International Cooperation Prak Sokhonn, who has been appointed as ASEAN Special Envoy on Myanmar, has announced plans for an official visit to the beleaguered nation in March, expressing his intention to meet all “relevant” sides that Naypyidaw will permit.",6,1
The Ministry of Foreign Affairs and International Cooperation has refuted an “unfounded report” by a well-known North Korean monitoring website that accused Cambodia of “abetting Pyongyang’s intelligence operations and illegal economic activities”.,11,0
"US President Joe Biden vowed on February 15 to push for a diplomatic resolution of the Ukraine crisis, but warned that a Russian invasion remained “very much a possibility” and that retaliatory sanctions were primed and ready.",15,1
Vietnam has completed negotiations on quarantine and is waiting for a licence on the official export of durian to China.,7,1
"Approximately 1.9 million households in Cambodia are currently engaged in agriculture production and feed around 15.8 million people. In 2012, one agri-food sector worker had to produce enough food to feed 2.8 people. And by 2030, predicted growth of towns and urban areas will mean that each worker will need to be productive enough to feed 4.5 people. This future burden is driving innovation in the sector.",10,2
"Thanks to dedicated efforts, the Beijing 2022 Winter Olympic Games can claim to be the first carbon neutral Games.",12,0
"Stung Treng provincial fisheries officiasl say the community has requested that the carcass of the last remaining Irrawaddy dolphin in Ochheuteal pleasance be kept in the community, after it was found dead on February 15.",15,3
"Beneath the backdrop of a spectacular sunrise, peeking through the lush nature surrounding them, William and Reaksmei Pheanu chase each other in a playground.",20,3
"The Preah Vihear Provincial Council has instructed officials to improve their response to the requests and needs of the community, urging local authorities to focus on the provision of public services and work to resolve disputes outside the judicial system.",8,0
"The Ministry of Planning is set to conduct a once-in-a-decade survey beginning in March to gather more accurate data on economic entities in Cambodia, more than 745,000 of which were listed in official registries as of last year.",8,1
"A total of 175 Cambodian migrant workers, including children, returned from Thailand through the O’Anlok border checkpoint in Ta Sen commune of Battambang province’s Kamrieng district on February 16. Almost one-third of them were required to quarantine as they were unvaccinated against Covid-19, or had received only one dose.",11,2
"Frasers Hospitality Pte Ltd, the hospitality arm of Singapore’s Frasers Property Group, is set to enter the Cambodian market with the 88-room Capri by Fraser, Phnom Penh in the capital slated to open in October.",35,1
"The inauguration of seven bridges in Kratie and Prey Veng provinces was presided over by Prime Minister Hun Sen on February 16. The bridges were built at a cost of about $40 million, with Japan contributing a $35 million grant and the government covering the shortfall.",12,1
"The government has increased retail fuel prices for the fourth bimonthly period in a row, as oil climbs towards $100 per barrel – a trend that has devastated the transport and private-hire sectors and other major petrol consumers ravaged by Covid-induced revenue losses for more than two years.",7,1
"The Phnom Penh Municipal Court has resumed the hearing for Kem Sokha, former leader of the Supreme Court-dissolved Cambodia National Rescue Party (CNRP), on charges of treason and conspiring with a foreign power to overthrow the Cambodian government.",14,1
The Cambodia Microfinance Association (CMA) and the independent financial information provider Credit Bureau (Cambodia) Co Ltd (CBC) have chipped in with a total of more than $2 million to support a five-year project designed to widen financial inclusion in the Kingdom.,13,3
[Advertorial] Ukraine tensions continue to test oil prices,1,0
"The Ministry of Health on February 17 reported 444 new Covid-19 cases, 14 of which were imported and all were confirmed to be the Omicron variant.",22,0
"Five officials from the Stung Treng Provincial Prison, including its chief and two deputies, have been transferred to new positions within the General Department of Prisons (GDP) following an incident in which seven inmates involving in drug trafficking committed a jailbreak. Replacements are expected to be announced on February 17.",11,1
"A senior Ministry of Health official has called on residents to not underestimate the possibility of a renewed attack by the Omicron coronavirus variant, and to participate in taking action to prevent the further spread of the virulent strain.",33,1
"Prime Minister Hun Sen has warned that the crisis in Myanmar could drag on for as long as a decade, should the proposed solutions for peace be too similar to previous ideas – none of which he believed had produced results.",12,0
"Prime Minister Hun Sen expressed his gratitude to Japan for inviting his son Hun Manet to visit, despite the fear of Covid-19. He also welcomed holding future joint military exercises.",34,2
"In the lead-up to the commune council elections scheduled for June 5, Prime Minister Hun Sen has called on authorities to make it easier for political parties to conduct activities.",7,0
"Prime Minister Hun Sen said Buddhism not only provided peace of mind, but also contributed to order and peace in society, development in all sectors and the preservation of the Cambodian national identity.",40,1
"The Ministry of Agriculture, Forestry and Fisheries and civil society are working together to improve the value chain of natural rubber make production more sustainable and boost economic growth.",6,1
"The Ministry of Foreign Affairs and International Cooperation on February 15 issued a statement allaying concerns about the establishment of the National Internet Gateway (NIG), saying they were unfounded.",0,0
"In Opinion:
Eye care, glasses should be included in our social insurance scheme",13,2
"Tourism players are brimming with enthusiasm about potential tailwinds for the embattled local industry, driven by the reinstatement and expansion of visa waiver schemes around the world and the global travel market’s return to full strength.",9,0
Soaring energy prices have brought massive profits to oil majors – along with fierce criticism from environmentalists and politicians at a time when consumers are left with rising bills.,12,0
Thailand's car market has come under pressure after a package of measures to promote electric vehicle (EV) purchases stalled before reaching the Cabinet for approval.,6,0
Japan beer giant Kirin on February 14 became the latest foreign company to announce that it was leaving Myanmar in the wake of a coup last year and a military crackdown on dissent.,12,1
Electricite du Laos (EdL) is aiming to significantly reduce expenditure in 2022 compared to 2021 in a bid to support government efforts to tackle economic and financial difficulties and stabilise macroeconomic growth.,5,1
"Despite high market demand for edible bird’s nests, the prices and investments involving the commodity have not shown significant positive trends in recent years, according to Cambodia Bird’s Nest Federation president Nang Sothy.",4,4
"Stakeholders are pushing for the transformation and modernisation of agriculture in Cambodia into a resilient, dynamic and high-growth sector that would more vigorously accelerate rehabilitation, poverty alleviation and inclusive growth to contribute to trade and food security.",5,4
The Ministry of Environment’s General Department for Nature Conservation and Protection on February 15 announced that it will put forest products harvested in the reservoir of the Stung Pursat I hydropower project up for auction.,10,1
"Banteay Meanchey provincial authorities have finished the planting of trees across the entire Zone 3 of the Tonle Sap Lake, with more than 30,000 flooded forest trees and bamboo seedlings planted in an area of about 12,000ha.",23,1
"The funds will be used to vaccinate Cambodians against Covid-19 from 2022 to 2023, and will include annual booster shots for those already vaccinated and first doses for children under 5.",4,2
"A senior official in Preah Vihear province said that in the last few years no Cambodians had crossed the border to illegally fell Kranhuong trees (Dalbergia cochinchinensis) in Thailand, as both authorities had tightened border crossings due to the outbreak of Covid-19.",14,0
