TITLE,LIKES,SHARES
Bird conservation groups in Cambodia have detected a significant increase in the number of waterfowl nests in the Boeung Prek Lapouv Protected Landscape Area in Takeo province for this year.,24,1
"CPP spokesman Sok Eysan said Yeab is a long-time CPP official whose qualifications to be first vice-president are obvious, such as his position on the party’s Standing Committee.",14,1
"The Council for the Development of Cambodia (CDC) has approved final registration certificates for 15 projects with capital investment of nearly $550 million in the first two weeks of this month, which could reportedly generate 13,952 new jobs in fields such as car assembly, power grids, garments and fruit processing.",19,3
Moorthy killed 21 people and terrorised entire villages in southern India for years before he was captured and retrained to repel similar attacks by other wild elephants starved due to deforestation.,26,1
"Financial institutions that are members of the Cambodia Microfinance Association (CMA) restructured more than $1.720 billion in loans for over 350,000 borrowers as of October 31, as applications steadily decline with Covid-19’s loosening grip on the Kingdom.",7,1
"Nearly 200 nations came together on November 13 on a global deal to combat climate change after two weeks of painful negotiation, but fell short of what science says is needed to contain dangerous temperature rises.",10,1
"New Delhi authorities on November 13 announced a one-week closure of schools and said they would consider a ""pollution lockdown"" to protect citizens from toxic smog.",23,0
"The 38-road construction project in Siem Reap town has added, repaired or upgraded a total of 108.74km of area roads. The estimated costs for the planned 13 months of construction are nearly $150 million and all of the work – which began on November 30 last year – is scheduled to be completed by year’s end.",39,2
Prime Minister Hun Sen has called on the families of deceased Covid-19 victims to be patient with the provision of subsidies when they are slow to arrive.,13,1
"Five more Covid deaths, 52 infections in Cambodia",10,0
Housing association joins anti-illegal-telecoms fight,11,0
"The Ministry of National Defence and Ministry of Foreign Affairs and International Cooperation hit back at the US for unilaterally imposing sanctions on two senior Cambodian military officials. The ministries said the sanctions were “senseless, provocative and politically motivated”.",22,0
Prime Minister Hun Sen has decided to lift all quarantine requirements for fully vaccinated travellers and visitors – both Cambodians and foreign nationals – effective from November 15 onward.,213,126
"Will policy reforms, new laws expose Cambodia to more treaty-based suits?",6,0
New health rules for public gatherings,23,1
"The works of a Cambodian artist and architect whose journey in life took him to such far-flung locations as Sudan, Ivory Coast, Qatar and the UK will be on display in a Singaporean gallery until April of next year.",7,1
"Bilateral trade between Cambodia and Singapore totalled $4.37 billion in the first 10 months of 2021, a 51.27 per cent year-on-year surge from $2.89 billion, as reported by the Ministry of Commerce, despite Covid-related disruptions to manufacturing supply chains.",39,1
"The Cambodia Safe Fish, Meat and Vegetables Association (CSFMVA) and the Cambodian Aquaculturist Association (CAA) have warned that many aquaculture farmers could quit the trade if the daily inflow of these fish remains unchecked.",23,1
"Over 100,000 seniors taking diploma exam",12,0
UNDP supports mine-free 2025 goal,1,0
"At least seven migrant workers returning from Thailand died on November 11 after drinking a lethal batch of bootleg hooch – containing an alcohol-based sanitiser – at a quarantine centre in Banteay Meanchey province, police and other authorities confirmed.",73,9
"Public gatherings for religious purposes will be allowed from December 1, the Ministry of Cults and Religions said in a November 11 instruction signed by minister Chhit Sokhon.",13,0
"UK-based Chestertons announced a business expansion to Cambodia to tap the fast development of the Kingdom’s real estate and construction sector, and add to its 100-strong network of international branches.",10,5
"The world is mired in a multitude of common issues that require strong commitment from all leaders, not limited to the Covid fight and preparation of strategies for economic rehabilitation and growth, but also geopolitics, trade wars and climate change, Prime Minister Hun Sen said on November 11.",2,1
[Advertorial] Prince Bank launches first drive-through ATM for the convenience and safety of customers,9,0
"According to Seng Hour, the best real estate in Sihanoukville currently costs around $4,000-$4,500 per sqm, down from $5,500-$6,000 at their height, and as low as $800-$1,200 in residential areas.",13,3
"On November 9, the Mission of the Republic of Korea to ASEAN celebrated ASEAN-Korea Day to commemorate the establishment of dialogue relations between ASEAN and Korea in November 1989.",4,1
"Taiwanese chip giant TSMC will partner with Sony on a new $7 billion plant in Japan, the firms announced on November 9, as an ongoing global semiconductor shortage squeezes the production of everything from cars to TVs and gaming consoles.",8,1
"Lao’s government has vowed to diversify its sources of energy by developing solar, wind power and coal-fired power plants to address the electricity shortage in the dry season.",3,0
[Sponsored] Hanuman Estate developing its first 300-hectare luxury project along National Road 5,13,3
"“The purpose is to develop a body of knowledge among officials at the women’s ministry to use as a basis for mobilising the participation of women – including grandmothers, mothers, aunts and sisters – to prevent the use, distribution and sale of illegal drugs in our communities,”",6,0
"Five more Covid deaths, 66 infections in Cambodia",8,1
"The Asia-Pacific region expects to rebound this year from last year’s economic slump, but countries with higher vaccination rates will recover faster compared to those lagging behind, the Pacific Economic Cooperation Council (PECC) said on November 8.",17,1
Laos and Thailand have agreed to set up a working committee to further discuss details and regulations concerning the reopening of their shared land border.,11,0
"Despite ongoing headwinds posed by the global Covid-19 crisis, bilateral trade between Cambodia and Japan maintained positive signs in the third quarter of this year.",13,2
"Nine men in pink jumpsuits with black facemasks bearing the circle, square and triangle symbols found on videogame console controllers are standing guard. With them is an imposing man dressed all in black and wearing a hooded cloak and mask and a woman in a robotic doll costume. They watch people play games against each other as a timer ticks down.",28,1
"The Vietnamese Cuu Long (Mekong) Delta province of Long An will work to further attract investment in its border economic zone, according to the latter’s management board.",16,1
"Minister of Tourism Thong Khon has been appointed as chairman of the 2021-2035 Mondulkiri Tourism Development Master Plan Steering Committee, to steward the work of transforming the northeastern province of Mondulkiri into one of Cambodia’s most captivating tourist destinations.",16,1
The Kantha Bopha Children’s Hospital called on students and adults in good health to donate blood at its blood donation unit to support and save children in Cambodia.,26,4
Domestic travel heats up as reopening plans unfurl across Kingdom,34,2
"Japanese companies are promoting their decarbonisation technologies at the 26th UN Climate Change Conference of the Parties (COP26). As decarbonisation is a global issue, related technologies could become a future focus of exports.",14,1
"Prime Minister Hun Sen instructed the Ministry of Land Management, Urban Planning and Construction to expedite the issuance of land titles and to solve land disputes and conflicts related to economic land concessions through non-judicial mechanisms when possible.",32,2
Prime Minister Hun Sen blasted unnamed analysts for statements indicating their desire to bring the Paris Peace Agreements back into force somehow. He said that calling for a reversion to that agreement was tantamount to calling for foreigners to take control of the country again.,28,3
"Authorities are set to lift restrictions on some “high-risk” businesses after November 30, including nightlife entertainment venues that rely heavily on alcohol sales such as KTV/karaoke parlours, nightclubs and bars, which have all been closed longer than other establishments.",50,4
"Trade between Cambodia and the US totalled $6.4793 billion in the first nine months of 2021, marking a 28.37 per cent year-on-year uptick from $5.0471 billion, according to the US Census Bureau (USCB).",13,2
"Six more Covid deaths, 68 infections in Cambodia",19,2
"Thai authorities arrested 72 undocumented Cambodian migrant workers and repatriated them to Cambodia on November 5, according to the Ministry of Foreign Affairs and International Cooperation.",15,1
,11,0
Construction of the main structure of the Century Plaza Shopping Mall on Russian Federation Boulevard (Street 110) has been completed and the establishment is scheduled to open before the Khmer New Year – which falls on April 14 in 2022.,30,2
"Bilateral trade between Cambodia and Thailand reached $5.97 billion in the first nine months of 2021, surging by 18 per cent year-on-year from $5.08 billion despite disruptions caused by the community spread of Covid-19 in the two ASEAN nations",14,1
"Nguon Nhel, First Vice-President of the National Assembly (NA), passed away on November 5 from illness at the age of 79, according to NA spokesman Leng Peng Long.",30,4
"Australian Senator and Minister for Foreign Affairs Marise Payne will pay an official two-day visit to Cambodia on November 7-8, according to a press statement from the Ministry of Foreign Affairs and International Cooperation.",10,1
"The Cambodian Valuers and Estate Agents Association (CVEA), a member of the ASEAN Valuers Association (AVA), is open to exploring new ideas and partnerships in its push to streamline real estate appraisal procedures and techniques in Cambodia, according to its president Chrek Soknim.",12,0
"A Myanmar junta court will this month hear closing arguments in Aung San Suu Kyi’s incitement trial, a source said on November 2, as it begins to wrap up proceedings that could jail the Nobel laureate for decades.",7,0
The Lao government expects to earn two trillion kip ($190 million) in revenue from bitcoin mining – the first time such revenue would be earned from the mining and trade of the digital currency.,99,22
"Since the end of September, the Ministry of Education, Youth and Sport has trained 3,292 teachers from secondary resource schools and network schools on how to manage distance learning to run online classes in a high-quality and efficient manner.",13,5
Seven killed when tire loss lands car in canal,74,5
Students do not need to show the card a second time as their vaccination status will then be noted down in the school’s records. If for some reason they do need to show it again they can bring a copied version.,12,3
"The Vietnamese Ministry of Finance has proposed slashing registration fees for locally built cars by 50 per cent until May 2022, to increase sales and encourage recovery in the automobile industry.",6,0
"World leaders on November 2 issued a multibillion-dollar pledge to end deforestation by 2030, a promise met with scepticism by environmental groups who say more urgent action is needed to save the planet’s lungs.",5,2
"Cambodia generated $3,692,183,189.37 from the export of 6.3 million tonnes of agricultural products to 68 international markets in the first 10 months of 2021, according to data published by Minister of Agriculture, Forestry and Fisheries Veng Sakhon.",52,2
"As of November 1, over 85 per cent of Cambodia’s total population of around 16 million had been vaccinated.",18,2
"Retail fuel prices have been gradually increasing in recent weeks, adding another burden for low-income households whose finances have been hit hard by Covid-19.",10,2
"The business community has welcomed a government decision to ease restrictions for local and foreign investors who reside in the Kingdom, particularly the waiver of hotel quarantine and the option to isolate at home.",71,6
MoEYS placing strong emphasis on youth empowerment policies,14,1
The Japanese government has donated 39 vehicles to help support Cambodia’s chairmanship of ASEAN in 2022.,12,2
"“Children have a lack of care and if they get caught in the rain it could make life difficult,” he said. “I suggest they use copies of their cards and the original cards should be kept at home.”",57,3
Tourism slated for Nov 30 reboot,19,2
Additional domestic and foreign borrowings plus a weaker peso further hiked the national Philippine government’s outstanding debt to a new high of 11.92 trillion pesos ($235 billion) in September.,9,1
"French President Emmanuel Macron on October 31 said Australia’s prime minister outright lied to him over a cancelled submarine deal, deepening an already fraught diplomatic crisis.",18,0
Ronaldo: Help or hindrance for Man Utd?,5,0
"Vietnam was the main buyer of fresh mango at 174,765.18 tonnes, followed by Thailand (26,969.28 tonnes), China (215.98 tonnes), South Korea (124.38 tonnes), Hong Kong (50.78 tonnes), Singapore (16.20 tonnes) and Kuwait (0.01 tonnes).",57,13
Stung Treng provincial Fisheries Administration officials warn that the Irrawady dolphins in the Ochheuteal dolphin pleasance in Borei O’Svay Sen Chey district’s Preah Rumkel commune are now faced with extinction as there is only one dolphin left remaining of the pod that was living there until recently.,13,2
"Kampong Cham provincial governor Un Chanda has issued a warning to Department of Water Resources and Meteorology director Om Vibol, who was drunk and created a scene during the inauguration of the province’s top public works and transport official.",7,0
"The Kingdom officially launched the vaccination campaign for children aged 5 on November 1, with that age group of 300,000 to be administered the Sinovac jabs. In the meantime, vaccinations for children aged 3 and 4 are being studied.",13,1
"“Don’t just depend on good medicines and throw caution to the wind,” he said. “But now we have a solid treatment plan because we have medicines for Covid-19 that we know work.”",68,6
"The Ministry of Environment issued a report highlighting three kinds of endangered monkeys which are present in large numbers in Cambodia, including the pig-tailed macaque, pileated gibbon and stump-tailed macaque.",24,1
"343,000 cultivated hectares wrecked by drought, floods",28,6
"The government has rolled out the 10th round of economic relief measures to manage the impact on key sectors from Covid-19 and the ongoing recovery process, and bolster economic growth during and after the crisis.",6,1
"Cambodia and Vietnam hailed bilateral cooperation in national security and maintaining peace, stability and security and encouraged the two countries’ border affairs committees to continue working closely together to resolve the remaining 16 per cent of border that had not been officially demarcated.",11,1
KIN Bun House preps to impress patrons hungry for fresh flavours,25,0
"Single-day road accidents leave seven dead, eight critically injured",33,0
"Kantha Bopha children hospitals treat over 30,000 patients",23,1
"The Asia Injury Prevention Foundation (AIP Foundation) will train 1,000 truck drivers who transport garment and footwear factory workers in Phnom Penh and six provinces to ensure safe commute for them.",44,7
Cambodia might have to deal with competition from popular destinations and a resurgence in Covid-19 cases in the region that could keep aviation growth down,48,3
"Set to engage 60 community-based tourism businesses and tour operators in Battambang, Pursat and Kampong Chhnang provinces, the initiative will provide training to drive up product and packaging standards, and beef up safety measures, Ratana said.",4,3
Ministry of Health spokeswoman Or Vandine confirmed that there had been no official decision whether to waive quarantine requirements for inbound Thai citizens and travellers from other countries.,33,1
A man was seriously injured and two vehicles gutted in a fire at a petrol station in O’Ambel commune of Banteay Meanchey province's Sisophon town on October 29.,24,2
Cambodia on October 28 rolled out two major instruments in relation to reopening plans for vaccinated visitors and safety protocols for travellers and locals.,10,2
The Ministry of Commerce has set up a website for November 24’s First Asia-Europe Economic and Business Forum (AEEBF1) for interested parties to register and to keep attendees updated with the latest information.,0,1
"The government has provided cash assistance to poor and vulnerable people since June 25, 2020, and since that time to September 24 this year, it has provided over $470 million from its coffers.",16,1
The Cambodian Human Rights Committee (CHRC) is working with the Office of the UN High Commissioner for Human Rights in Cambodia (OHCHR) to organise a regional workshop on October 28 to accelerate the establishment of a National Human Rights Institution based on the Paris Principles.,11,0
"Minister of Commerce Pan Sorasak has requested Australia for more technical assistance and cooperation, to support trade and other aspects of economic development, as bilateral trade continues to grow at a largely steady pace.",4,0
[Advertorial] Metfone: Digital Transformation That Leaves No-one Behind,7,1
"The private sector has voiced readiness to work with the government to get priority works done and fulfil plans to develop public-private partnership (PPP) mechanisms, harness technology and leverage the benefits secured from trade deals, with a view to supporting a sustainable national economic recovery.",19,2
Mondulkiri provincial hall spokesman Sorn Sarun told The Post on October 26 that the provincial administration requested that the people be granted legal recognition of their rights to the land and that any remaining be developed for ecotourism investment.,6,1
Prime Minister Hun Sen said the prolonged Covid-19 pandemic over the past two years had been a challenging period for the Cambodian government as well as the rest of ASEAN – but one that he felt was nearing its end soon because ASEAN’s feet were now planted firmly on the path leading to a post-pandemic recovery era.,17,1
Little Hearts Organisation (LHO) is an NGO that provides abandoned children with quality educations while also giving support to impoverished families in order to make it less likely that situations as extreme as abandonment ever occur in the first place.,26,4
Myanmar's junta on October 24 labelled the UN’s latest rights report on the conflict-wracked nation an “incitement to violence” and accused the body of interfering in its internal affairs.,11,0
Periodic photo-identification surveys indicate that the number of dolphins fell from seven in 2009 to six in 2012 and then three in 2018 and now just one dolphin remains there in 2021.,88,5
The National Assembly (NA) has unanimously passed draft amendments to several articles of the Constitution aiming to mandate single citizenship for the nation’s top office holders.,20,6
"Japanese automakers expect production to be down by at least 1.3 million units in fiscal 2021 (April 1, 2021 to March 31, 2022) due to the global semiconductor shortage and the Covid-19 pandemic situation in Southeast Asia, according to eight major manufacturers.",19,1
"Despite disruptions caused by the fourth wave of the Covid-19 pandemic, Vietnam’s steel producers still reported extraordinary profits.",8,0
[Sponsored] Nissan Terra built on over 60 years of SUV heritage,9,0
Facilitating investment flows to least developed and developing countries and creating favourable investment environments is necessary to support and accelerate economic recovery in the post-Covid-19 era,2,0
"World Health Organisation (WHO) representative to Cambodia Li Ailan said it was good news that economic activity will resume as businesses and the general public have been hit hard by the pandemic, but she also cautioned that everyone has to strike a balance between reopening and the implementation of health measures.",30,2
"Nine more Covid deaths, 128 infections in Cambodia",36,3
"Cambodia lifts ban on flights from Malaysia, Indonesia and Philippines",43,7
The Ministry of Information is looking to build radio and TV stations within the Preah Monivong Bokor National Park in Kampot province's Bokor town to expand media coverage in the Kingdom's coastal areas and islands.,36,2
"As Cambodia commemorates the 30th anniversary of the Paris Peace Agreement on October 23, Prime Minister Hun Sen recalled his win-win strategy that eventually brought about full peace in 1998 after decades of war and factional conflict.",19,0
Hang Puthea is a member of the NEC and also serves as its spokesman. He sat for an interview with The Post to discuss voter registration and election procedures.,16,0
The Stung Treng provincial Department of Culture and Fine Arts is looking into the possibility of registering Nom ansorm chrouk – sticky rice cakes filled with pork and wrapped in banana leaves – and several other dishes as food originating from the province.,91,8
"Heightening geopolitical competition among major powers is bearing far-reaching negative implications for foreign direct investment (FDI) flows across the world, and although the Covid-19 crisis drags on, it offers unprecedented impetus to the digital revolution.",9,1
"“We plan to expand Prasac Microfinances’ portfolio for transition into a commercial bank and plan to add KB Kookmin’s strengths in the process,” a KB Kookmin official said, as quoted by the Korea Herald.",23,1
The Ministry of Foreign Affairs and International Cooperation has announced the resumption of its tourist visa and visa exemption programme after a long hiatus due to the Covid-19 pandemic.,54,3
,5,0
The Ministry of Health has instructed relevant authorities to stop running Covid-19 tests on the body of anyone who dies from causes other than the disease.,26,2
"11 more Covid deaths, 148 infections in Cambodia",16,1
"The government and civil society organisations on October 19 held a National Policy Dialogue to find ways to end violence against children (VAC), while commitments to eliminate the issue have been announced to showcase progress in preventing and responding to VAC in recent years.",15,1
"In Opinion:
Alone together: Why social connections are essential to mental health",4,2
"Nearly 100 per cent of the more than 37,000 detainees nationwide have received a second dose of Covid-19 vaccine, with only a small number of them remaining unvaccinated including those with underlying health conditions",6,1
[Advertorial] Strong bond yield-driven dollar pins down gold prices,8,0
"Construction of the $70 million two-phased Arakawa Residence affordable housing development in western Phnom Penh remains on track to be completed by mid-2022, developer Arakawa Co Ltd co-founder Ieng Sotheara told The Post on October 20.",86,9
,6,0
The far too frequent inspections of mining sites by the different sets of authorities and exceedingly high costs of the equipment required to supply electricity to mining- and energy-related businesses remain a couple of the predominant issues hobbling the sector.,14,0
Kandal and Banteay Meanchey provincial authorities have called on residents to be more careful with snakes and other venomous animals in the rainy season.,3,0
Newly-appointed Battambang provincial governor Sok Lou instructed law enforcement officers along the border to increase their vigilance and work to prevent illegal border crossing into Thailand.,19,0
"However, he said, agricultural exports must meet SPS and food safety standards outlined by Chinese laws and regulations. Similarly, imports must conform to the Kingdom’s legal SPS rules.",5,0
"The Cambodia-South Korea Free Trade Agreement (CKFTA) is set to be signed on October 26, ushering in a new chapter that will open up fresh avenues in trade and investment between the two Asian nations, according to a senior Ministry of Commerce official.",8,1
IZ launches climate action training course,0,0
"“With this consideration in mind, [the government] has been facilitating the reopening and resumption of some key sectors toward living with Covid-19 in the ‘new normal’,” he said.",10,3
"South Korea will test its first domestically-developed satellite launch vehicle this week, which, if successful, will mark a major step forward in the country’s space programme.",11,3
"In Opinion:
Happy are those who love to go to court. If the pre-existing standards on unfair competition have been unable to do the job, the newly adopted Law on Competition will and must do the job. But what kind of job?",13,0
"Holidaymakers made 138,099 domestic trips across Cambodia during the third weekend of the month, from October 15-17, with Preah Sihanouk province ranking as the top destination, according to the Ministry of Tourism.",22,1
"""They have been charged on two counts – drug trafficking and illegal firearm possession,"" he said.",23,1
More than 80 pythons were transported from the Phnom Tamao Zoological Park and Wildlife Rescue Centre for release into the Phat Sanday Fisheries Conservation Area in Pursat province’s Kandieng district.,34,1
