TITLE,LIKES,SHARES
"Longfruiter Anlong Veng Oddor Meanchey Agriculture Park Co Ltd has invested $51 million in the cultivation of bananas and fruits in Anlong Veng district, Oddar Meanchey province to boost exports, especially to the Chinese market",22,2
Mondulkiri officials under scrutiny over land,23,0
"A handful of seven-day pilot farmers’ markets are set to kick off from end-January till early February at PTT filling stations in Phnom Penh and four provinces, to bring Cambodian products closer to consumers, according to Ministry of Commerce spokesman Pen Sovicheat.",11,1
"The Ministry of Commerce is seeking support from Singapore in economic cooperation in the digital space and retail sales in small- and medium-sized enterprises (SME), as data traffic soars during the Covid-19 crisis.",17,0
"The Ministry of Agriculture, Forestry and Fisheries on January 21 signed a memorandum of understanding (MoU) with three companies geared towards the production of a minimum of 400 tonnes of additional vegetables per year to supply the domestic market and ship abroad.",11,1
Luxembourg donates over $1M for Mekong,10,1
Officials have requested modern technological equipment to enable them to continue their work of collecting unexploded ordnance (UXO) in sunken warships in the Mekong River in four areas of Kandal and Preveng provinces.,15,1
The Ministry of Health has issued guidelines to help people prevent the spread of Covid-19 and bird flu as well as food and alcohol poisoning during Khmer New Year celebrations in mid-April.,25,0
"Cambodian migrant workers continue to return home through border provinces, with those who are unvaccinated being placed immediately in quarantine, and with all being subject to temperature checks.",36,1
"Police are continuing to search for those responsible for the murder of a young woman who was found buried in a shallow grave by villagers in Preah Sihanouk province’s Prey Nop district. The woman’s hands were handcuffed, and a restraint was tied around on knee.",62,1
"More than 2,000 inmates at prisons and correctional centres across the country have been vaccinated with their third dose of the Covid-19 vaccine, while 38,000 detainees have already received two doses, according to General Department of Prisons spokesman Nouth Savna.",13,1
The Phnom Penh Municipal Police’s Fire Prevention and Rescue Department on January 24 received four fire engines.,47,2
Minister of Interior Sar Kheng has requested that FUNCINPEC vice-president Prince Norodom Chakravuth convene a congress to elect a party leader. The request came as the party held an internal meeting and is preparing to hold a congress next month.,13,0
The Ministry of Culture and Fine Arts has requested that the countries along the Mekong River work together and with the international community to stop the illegal trafficking of antiquities.,25,0
10 more Omicron community cases in Cambodia,7,2
"Nagaworld has issued a statement regarding the impacts of Covid-19 on its operations in response to the recent strike by some of its employees, saying the pandemic led to $77 million in losses and forced it to lay off thousands of workers.",34,0
The Supreme Court on January 24 upheld the 18-month prison sentence handed down to a former two-star general for violating government lockdown orders in April last year. The decision followed a hearing on January 17.,17,0
Scientists are keeping a close watch on a recently-discovered sub-variant of the Omicron version of the Covid-19 virus to determine how its emergence could affect future pandemic spread.,29,0
"Tens of thousands of Indonesia’s indigenous people are at risk of being expelled from their lands to make way for the construction of a new capital on jungle-clad Borneo island, a rights group warned on January 21.",18,0
"Beijing city officials on January 23 said all two million residents of a neighbourhood where a small cluster of coronavirus cases was detected will be tested, less than two weeks before the start of the Winter Olympics.",15,0
Vietnam is to focus on the development of 6G – the sixth-generation standard currently under development for wireless communications technologies – this year.,23,2
"Thailand's export growth last month soared by 24.2 per cent year-on-year, commerce minister Jurin Laksanawisit said on January 21.",9,1
"The exit of energy titans TotalEnergies and Chevron from Myanmar’s billion-dollar gas industry has been hailed by rights groups, but analysts say it will not significantly weaken the generals and may even enrich the military in the short term.",37,1
"Watanya Wongopasi, a member of parliament (MP) of Thailand’s ruling Palang Pracharath Party (PPRP), has suggested that the Excise Department study every aspect carefully before imposing taxes on cryptocurrency trading and sales of stocks.",13,0
"A three-level building with western-style decor houses Playroom Cambodia, a newly established ultimate indoor entertainment centre in Toul Kork district featuring axe throwing and archery for those seeking a unique sporting experience.",66,5
"In Opinion:
Covid shows sustainable financing of WHO is needed to deliver health for all",18,1
"The Ministry of Commerce is revising some of the content of the draft national policy on cashew nuts in preparation for government approval, which industry players are optimistic will make Cambodian cashew nut products more reputable and exportable.",6,0
"Svay Rieng has become the first province to stop open defecation due to the commitment of the provincial and local authorities in raising awareness among the populace, according to the provincial Department of Rural Development.",16,0
Local publicly listed Acleda Bank Plc plans to expand cross-border payment services to two more ASEAN countries – Laos and Vietnam – following apparent success in Thailand.,10,1
"UNICEF has released a new musical anthem on climate change across the airwaves and social media to highlight the impact of climate change and practical actions that everyone can take to mitigate it, with the expectation that an estimated 250,000 people will hear the song.",9,1
"Retail fuel prices are ticking back up following a sorely needed moderation witnessed in November-December, as filling station owners report sharp declines in sales.",8,0
"The process to open market access for exporting Cambodian “pra” varieties of shark catfishes to China has begun in earnest, after officials from the two countries kicked off formal phytosanitary talks, far earlier than expected.",18,0
"The government will start implementing the e-commerce value-added tax (VAT) from April 1, as the General Department of Taxation (GDT) updates a variety of technology systems for taxpayers.",8,0
"The Cambodian Human Rights Committee (CHRC) and the French embassy in Phnom Penh have pledged to deepen and improve relations between the two countries, especially on human rights cooperation, with both sides agreeing that this is an area that requires attention.",19,0
25 more Omicron community cases in Cambodia,16,0
"A man was sent to the Phnom Penh Municipal Court on January 23 with over 25kg of methamphetamine, ketamine and ecstasy, while another man with 17kg of dried marijuana was referred to the Battambang Provincial Court in a separate case on the same day.",38,0
[Sponsored] U-Pay and E-GetS ink MoU as strategic partners for digital payments,1,0
"Prime Minister Hun Sen maintained that his recent Myanmar visit managed to “plant trees, not cut them down”, in an apparent response to critics including Malaysia’s top diplomat.",30,0
The Ministry of Interior’s Department of Information Technology has presented seven tips to protect the security of computers and computer systems across the Kingdom to prevent hackers from trespassing and committing cybercrimes.,13,1
"Nearly 300,000 people have received their fourth doses of Covid-19 vaccines in the first nine days of the vaccination campaign which started on January 14 at public hospitals and health centres in Phnom Penh, according to the Ministry of Health.",24,0
"The Ministry of Health on January 23 reported 26 new Covid-19 cases, five of which were imported and all were confirmed to be the Omicron variant.",14,1
The Myanmar State Administration Council- (SAC) appointed foreign ministry on January 21 described the skirmishes in Kayah state capital Loikaw 10 days earlier as an attack staged by “terrorists”.,20,0
"The number of households nationwide with access to clean water reached 1,091,869 last year, up by 11.80 per cent from 976,621 in 2020, according to the Ministry of Industry, Science, Technology and Innovation.",24,3
"A fire levelled a storage facility of bag factory Outdoor Gear (Cambodia) Co Ltd in western Takeo province on January 21, destroying tonnes of materials.",26,1
Forestry Administration officials retrieved seven motion-activated camera traps for wildlife research that were installed within the territory under the purview of the Prambei Mom forestry community in northern Kampong Speu province.,27,0
"Twenty-one Cambodian women UN peacekeepers received certificates of French language proficiency on January 20, following the completion of a two-year course provided prior to deployment to French-speaking countries.",80,4
Thai property developers expect to hike their prices by three-to-five per cent this year due to rising construction costs and a restoration of balance in the property market.,25,2
16 more Omicron community cases in Cambodia,15,1
Round 8 for gov’t cash handout programme,5,1
"Kingdom, EU top diplomats discuss Myanmar crisis",9,1
"The Covid-19 pandemic caused global investment activities to fall – due to economic uncertainties, lockdowns, supply chain disruptions and postponement of investment by multinational enterprises.",15,2
"The Cambodia Chamber of Commerce (CCC) and Japan External Trade Organisation (Jetro) in Cambodia have agreed in-principle to examine the possibility of signing a memorandum of understanding (MoU) in the near future, to strengthen and deepen cooperation on investment and trade between the two nations.",13,1
Education ministry unveils Omicron-era rules,6,0
The 98-year-old National Library was built in 1924 by the French-colonial government in Indochina. In 1954 – after Cambodia gained independence from France – the library was renamed from the Central Library to the National Library of Cambodia (NLC).,26,1
"The administration wants to rent their farmland for one season to prepare for the second round of the “social rice field” project in order to produce rice to help the poor of the district, especially those affected economically by the Covid-19 pandemic.",23,4
"Prime Minister Hun Sen on January 21 maintained that his recent Myanmar visit served “to plant trees, not to cut them down”, and blasted Malaysia’s top diplomat over “undiplomatic” comments concerning the trip.",21,0
Prime Minister Hun Sen has given the green light for anyone who contracts the SARS-CoV-2 Omicron mutation or any other variant to convalesce or receive treatment at home or in any other reasonable non-healthcare setting.,91,12
Astrophotography Cambodia debuts local stars at show,15,0
"North Korea hinted on Jaunuary 20 that it could resume its nuclear and long-range ballistic missile tests, as top officials led by Kim Jong Un said the country was preparing for a “long-term confrontation” with the US, state-run media reported.",11,0
"Anti-coup fighters attacked a government office in eastern Myanmar with rockets and grenades on January 19, killing over a dozen junta troops according to the rebels and local media.",31,1
"Vietnam's Cuu Long (Mekong) Delta region, which covers 13 cities and provinces, has many advantages for attracting investment, especially foreign direct investment (FDI), thanks to its huge potential for agricultural production and renewable energy development.",3,0
"Household debt in Thailand is likely to hit nearly 90 per cent of gross domestic product (GDP) in the first half of the year, according to Siam Commercial Bank’s Economic Intelligence Centre (EIC).",21,3
"Kingdom, Japan go over water resource management",5,1
"Cambodia Kantha Bopha Foundation on January 20 said it received more than $20 million in donations last year – $6,318,465 in US dollars and 56,351,587,500 riel ($13.8 million).",61,1
"Cambodia exported 423,168.97 tonnes of fresh bananas last year, up by 27.02 per cent over 2020, valued at $4,323,719,300, according to preliminary data from the Ministry of Agriculture, Forestry and Fisheries’ General Directorate of Agriculture (GDA).",15,2
"Cambodia, along with China and South Korea, has among the 10 most mature retail central bank digital currencies (CBDC).",33,0
The Ministry of Foreign Affairs and International Cooperation has condemned drone and missile attacks on parts of UAE capital Abu Dhabi that killed at least three people on January 17.,29,1
"The Ministry of Health will beef up its campaign on behaviour changes in the area of nutrition for mothers, babies and children, as 14 per cent of women at reproductive age are underweight while another 45 per cent are anaemic.",6,1
CCF finds 103 gas stations ‘breaking consumer law’,22,1
Japan funds three projects for children,14,1
"ASEAN tourism leaders have officially announced the reopening of the regional sector and introduced a number of key principles to be implemented, even as some member states grapple with outbreaks of the coronavirus Omicron variant.",14,0
"In just the first week of availability, more than 160,000 people have received their fourth dose of Covid-19 vaccine since the booster campaign began on January 14 for people from all over the country.",31,1
The Ministry of Labour and Vocational Training and a number of stakeholders held a consultative workshop to discuss occupational hazards in the construction sector and the scope of the cover that the National Social Security Fund (NSSF) can provide for workers in the industry.,18,0
Ratanakkiri districts’ state land usage planning underway,8,0
30 more Omicron community cases in Cambodia,10,1
"A senior official reiterated that no one could ever break the “ironclad” friendship between Cambodia and China, as the bond has gone through many trials and difficulties in history, while in recent years the two countries have also strengthened their cooperation in all sectors.",31,0
"The Ministry of Environment remain committed to enforcing laws against the illegal wildlife trade in Cambodia. It said that in 2021, rangers and partner NGO officials removed a total of 61,611 snares installed in natural protected areas.",32,3
The Ministry of Foreign Affairs and International Cooperation has expressed serious concerns over the intense clashes in Loikaw – the capital of Myanmar’s Kayah State – between the military and armed opposition forces including the state’s largest ethnic minority militia.,15,2
"Prime Minister Hun Sen met with Vietnamese foreign minister Bui Thanh Son for wide-ranging talks on issues of mutual concern, with both sides committing to facilitating an increase in their trade volume in order to reach more than $10 billion for 2022.",8,2
It has been far too long since we saw still-stuck-in-the-1980s policymakers propose something completely out of touch with the changing world.,25,3
"Crocodile meat has long been consumed by Cambodians and travellers alike, who particularly enjoy the reptilian protein in the restaurants of tourism hub Siem Reap.",32,6
The national Covid 19 vaccination committee is continuing to push for an increase in at-home vaccinations for those who live in remote areas and cannot access designated sites.,19,1
The World Bank has approved financing that – along with a grant from the Global Partnership for Education – will provide $69.25 million in new funding to help Cambodia improve equitable access to basic education and respond rapidly to crises affecting the education system.,14,2
"The Kingdom exported nearly 265,230 tonnes of fresh mangoes and mango products in 2021, up by 146.3 per cent year-on-year, of which the Vietnamese market absorbed just under 199,636.7 tonnes, according to Ministry of Agriculture, Forestry and Fisheries data.",6,0
"The Ministry of Education, Youth and Sport instructed all education departments and public and private educational institutions across the country to strengthen health safety measures for educators and students for the academic year 2021-2022.",13,0
"The well-known Tad Yeuang waterfall in Pakxong district, Champassak province, has been recognised with an ASEAN sustainable tourism award, which will be presented to provincial officials at a ceremony to be held in Cambodia.",15,1
"Myanmar’s ousted civilian leader Aung San Suu Kyi was “indispensable” to restoring democracy to the country, the Philippines foreign minister said recently, echoing condemnation of her recent sentencing by a junta court.",16,0
The World Health Organisation (WHO) on January 18 warned against the notion that the Covid-19 pandemic becoming endemic would mean the disease was no longer dangerous.,29,0
"The volume of online loan applications through Acleda Bank Plc has increased significantly over the past two years, tallying up to about 400,000 since 2020, according to its president and CEO.",3,1
"CSX has expressed commitment to increase the number of equity and debt securities traded on the bourse this year, with particular focus on small- and medium-sized enterprises from burgeoning sectors such as information technology, telecoms, healthcare, logistics, and food and beverage.",1,0
The Phnom Penh Municipal Court of Appeal on January 18 heard the case of a woman who was sentenced to 16 years in prison for attempting to traffic seven underage Cambodian women to Malaysia.,16,2
[Advertorial] US Federal Reserve policy decision to influence gold prices,3,0
ASEAN working group prepares new proposals for Cambodia as chair,5,0
Cambodia and Bangladesh have announced mutual support to further strengthen bilateral ties and cooperation between the two countries.,6,0
"Many cases of K57 grenade launcher ammunition and 30 82mm recoilless rifle shells were destroyed by the HALO Trust on January 19, after people found them buried in the ground in Trapaing Chor commune’s Chheuteal Chrum village of Kampong Speu province’s Oral district.",8,1
"The Ministry of Labour and Vocational Training announced that it would halt financial support for more than 320,000 factory workers who were laid off due to their factory suspending work because of the Covid-19 pandemic.",18,1
"The Ministry of Justice has formed a task force to fight money laundering and the financing of the proliferation of weapons of mass destruction and terrorism, consisting of 28 members led by justice minister Koeut Rith.",30,1
"Three Cambodian localities have clinched the ASEAN Clean Tourist City Award for 2022-2024, underscoring their allure as travel hotspots that provide a comfortable degree of Covid safety, as the Kingdom relaxes pandemic control measures for visitors who have taken the jab.",16,1
Russia has provided $2.8 million as part of the UN World Food Programme funding to support the implementation of a sustainable school food system development project in Cambodia.,51,2
"The plan to restore ASEAN tourism after the Covid-19 crisis will be a key strategy for the gradual reopening of international tourism, Prime Minister Hun Sen said in Preah Sihanouk province on January 18.",28,0
"The Kep-Koh Tonsay Tourism Port, a pier on mainland Kep town replacing an old one, was inaugurated on January 19, and is expected to greatly benefit the provincial economy, and go a long way to support the local tourism, agriculture and fisheries sectors.",63,8
Kampot provincial authorities on January 18 burned more than half of 12 tonnes of unlicensed seafood products imported from Vietnam after they were found to contain chemical substances that may be harmful to people’s health.,26,2
19 more Omicron community cases in Cambodia,16,0
"The Ministry of Agriculture, Forestry and Fisheries announced that it has recognised seven new community forests in 2021, bringing the total number of community forests across Cambodia to 536, which cover more than 400,000ha.",17,0
"Around 100 participants from the Ministry of Economy and Finance, the Ministry of Health and NGOs working in the health sector held an online forum on January 18 to discuss tobacco taxes in a bid to reduce deaths, illnesses and disabilities caused by tobacco.",15,0
The trial of former opposition leader Kem Sokha on treason charges resumed at the Phnom Penh Municipal Court on January 19 after a long hiatus due to the Covid-19 pandemic.,9,0
"One evening last month at an art gallery in the capital, those attending arrived and saw a wall filled with photos and pictures – both film prints and paintings – combined together in an undeniably creative and stunning presentation that conveyed a sense of many different cultures and religions overlapping.",23,0
Will New Year bring new political dynamics?,19,1
"Chinese investment in Cambodia will bolster the production and export of fruits and other agricultural produce and shore up the development of sustainable value chains, according to Minister of Agriculture, Forestry and Fisheries Veng Sakhon.",16,2
"Plans are underway to expand the capacity of the Kingdom’s largest solar power station, by nearly 167 per cent from 90MW to 240MW, to help meet demand and reduce energy costs, according to the head of state-run electric utility Electricite du Cambodge (EdC).",35,2
"The Council for the Development of Cambodia (CDC) on January 17 announced that it had approved final registration certificates for 10 investment projects across various sectors worth a staggering total of nearly $1.90 billion and expected to create 7,014 jobs.",13,0
"At least 101 people were killed and 237 others injured in 185 road accidents from January 1 to 17, according to National Road Safety Committee (NRSC) secretary-general Min Meanvy.",56,6
"Siem Reap is to welcome back Songkran celebrations on the first day of Khmer New Year, following two years of pandemic-driven postponements, according to provincial governor Tea Seiha.",38,6
A senior Ministry of Health official has warned of legal action against doctors who open clinics without legal permission or registration.,24,0
"The government has decided to add Win-Win Policy Day, December 29, to the annual calendar, albeit not as a public holiday, according to a letter signed by Prime Minister Hun Sen on January 14.",8,0
"The new CEO of the Mekong River Commission (MRC) Secretariat, Anoulak Kittikhoun, pledged to improve the inter-governmental organisation as he took office on January 17.",3,0
The Ministry of National Defence affirmed that ASEAN secretary-general Lim Jock Hoi was committed to working with the ministry and coordinating with all ASEAN partner countries to assist Cambodia in the successful organisation of the ASEAN Defence Ministers’ Meeting (ADMM) and related meetings.,7,0
"The Techo Sen Institute of Public Works and Transport (TSI) announced the launch of a capacity building project on road maintenance methods to improve sustainable infrastructure in Cambodia, Laos and Vietnam, with the expectation that the project will provide an opportunity for the three countries to share experiences and strengthen capacities in training and job performance.",5,0
The Battambang Provincial Court has placed three people in pre-trial detention in connection with the illegal occupation of land in the flooded forest area of Zone 3 of the Tonle Sap Lake.,20,1
"In 2021, the Bar Association of the Kingdom of Cambodia’s (BAKC) public defenders programme assigned lawyers to work on 5,182 cases involving 8,425 impoverished people. Of the total, there were 1,453 juvenile cases.",6,1
The Fisheries Administration has issued a notice to all offshore fishermen in Cambodia that fishing for mackerel during the spawning season from January 15 to March 31 is forbidden.,6,0
"[Special Supplement] Banking on technology, Dr In Channy takes ACLEDA to new horizons",71,11
[Special Supplement] A 30-year history of achievement,12,0
[Special Supplement] Reaching out with a diverse range of products and services,2,0
[Special Supplement] ACLEDA Institute of Business prepares students for successful banking careers,0,1
"[Special Supplement] With CSR efforts, ACLEDA living up to ‘Bank for the People’ motto",4,0
[Special Supplement] Steel-maker Tang Meng Rath thrives with support of ACLEDA,13,0
[Special Supplement] New generation ACLEDA Bank is ready for future challenges,0,0
[Special Supplement] Trusted technology partner TechAdwiser hails ACLEDA Bank’s E-shop milestone,0,0
[Special Supplement] ACLEDA creates most extensive network to be closer to clients,11,0
"The UN’s latest evaluation of Cambodia states that the Kingdom has fulfilled the three basic conditions necessary for graduation from least developed country (LDC) status, including a gross national income (GNI) per capita of $1,377 which surpasses the $1,222 threshold",20,0
[Advertorial] Australia Cambodia Education Academy offers full benefits of Australian education,31,1
"Over the first four days of the Covid-19 fourth-dose vaccination campaign, nearly 100,000 people volunteered to get the jabs. The campaign kicked off on January 14 as the Omicron variant continues to spread in the Kingdom.",26,1
23 more Omicron community cases in Cambodia,18,1
Molnupiravir treatments available at Cambodia Post,9,1
Prime Minister Hun Sen urged ASEAN to reopen tourism and trade now that many of the bloc’s member countries have vaccinated their populations.,23,0
